{
  "tipo_documento": "MANIFIESTO",
  "codigo_ut": "3469205",
  "data_carga": "2026-06-11",
  "hora_carga": "05:00",
  "origem": "SALVESEN LOGISTICA PORTUGAL",
  "origem_morada": "ESTRADA NACIONAL 3 KM 5.7, Azambuja, 2050-306 Lisboa",
  "transportadora": "J. MARCOS, FÁBIO E SEATLLE TRANSPORTES LDA",
  "matricula": "24-XC-34",
  "natureza": "PRODUTO A TEMPERATURA CONTROLADA 4º/Ambiente",
  "paginas_consideradas": [1],
  "destinos": [
    {
      "sequencia": 1,
      "origem": "SALVESEN LOGISTICA PORTUGAL",
      "nome": "AMARAL E FILHOS DISTRIBUIÇAO S",
      "morada": "Z. IND. MASSAMA - R. SEBASTIAO E SILV",
      "codigo_postal": null,
      "cidade": "MASSAMA",
      "data_limite": "2026-06-11",
      "hora_limite": "13:00",
      "temperatura": "4",
      "peso_kg": 213.67,
      "pales": 0.33,
      "pedido": "5023045896 / 415208086",
      "fornecedor": "Danone Portugal Capilar (013)",
      "confianca": 1.0
    },
    {
      "sequencia": 2,
      "origem": "SALVESEN LOGISTICA AZAMBUJA 2",
      "nome": "LUCKYVISION - TRUCKING",
      "morada": "PARQUE INDUSTRIAL SOLVAY MARINHAS Dª ANA, QUEBRADAS DE CIMA, AV. ERNEST SOLVAY ARMAZÉM 2 FRAÇÃO B E C",
      "codigo_postal": "2625-090",
      "cidade": "PÓVOA DE SANTA IRIA",
      "data_limite": "2026-06-11",
      "hora_limite": "08:00",
      "temperatura": "Ambiente",
      "peso_kg": 2314.22,
      "pales": 2.85,
      "pedido": "5023052772 / 415197196",
      "fornecedor": "Alpro Portugal (311)",
      "confianca": 1.0
    },
    {
      "sequencia": 3,
      "origem": "SALVESEN LOGISTICA PORTUGAL",
      "nome": "AMARAL E FILHOS QUELUZ",
      "morada": "RUA SEBASTIAO E SILVA N.17",
      "codigo_postal": "2745-779",
      "cidade": "QUELUZ",
      "data_limite": "2026-06-11",
      "hora_limite": "00:00",
      "temperatura": "Ambiente",
      "peso_kg": 501.00,
      "pales": 1.00,
      "pedido": "REF-F 659721REP06091111",
      "fornecedor": "Lactacores (405)",
      "confianca": 0.8
    },
    {
      "sequencia": 4,
      "origem": "SALVESEN LOGISTICA PORTUGAL",
      "nome": "C-AMARAL E FILHOS DISTRIBUIÇÃO S",
      "morada": "ESTRADA MEM MARTINS ARMAZEM 3, 2725-000 MEM MARTINS",
      "codigo_postal": "2714-506",
      "cidade": "ALGUEIRÃO-MEM MARTINS",
      "data_limite": "2026-06-11",
      "hora_limite": "00:00",
      "temperatura": "Ambiente",
      "peso_kg": 501.00,
      "pales": 1.00,
      "pedido": "REF-F.659719REP06091111",
      "fornecedor": "Lactacores (405)",
      "confianca": 0.8
    }
  ],
  "confianca_ocr": 0.9,
  "necessita_revisao": true
}
