{
  "tipo_documento": "MANIFIESTO",
  "codigo_ut": "3466594",
  "data_carga": "2026-06-08",
  "hora_carga": "05:45",
  "origem": "SALVESEN LOGISTICA AZAMBUJA 2",
  "origem_morada": "RUA DO RIO TEJO 1, 2050-306 Vila Nova da Rainha - Lisboa",
  "transportadora": "J. MARCOS, FÁBIO E SEATLLE TRANSPORTES LDA",
  "matricula": "0000XXX",
  "natureza": "PRODUCTO A TEMPERATURA CONTROLADA 4º/Ambiente",
  "paginas_consideradas": [
    1
  ],
  "destinos": [
    {
      "sequencia": 1,
      "origem": "SALVESEN LOGISTICA AZAMBUJA 2",
      "nome": "LUCKYVISION UNIPESSOAL, LDA",
      "morada": "RUA AFONSO DE ALBUQUERQUE 19",
      "codigo_postal": "2780-307",
      "cidade": "OEIRAS",
      "data_limite": "2026-06-08",
      "hora_limite": "15:32",
      "temperatura": "Ambiente",
      "peso_kg": 2314.22,
      "pales": 2.85,
      "pedido": "5022935318 / 415147499REP06051548",
      "fornecedor": "Alpro Portugal (311)",
      "confianca": 1
    },
    {
      "sequencia": 2,
      "origem": "SALVESEN LOGISTICA PORTUGAL",
      "nome": "LIDL E CIA LOURES",
      "morada": "E.N. 250 - RUA CASAL DOS REIS",
      "codigo_postal": "2670-566",
      "cidade": "LOURES",
      "data_limite": "2026-06-08",
      "hora_limite": "00:00",
      "temperatura": "4",
      "peso_kg": 1932,
      "pales": 3.2,
      "pedido": "948062",
      "fornecedor": "Tropicana España Base (015)",
      "confianca": 1
    },
    {
      "sequencia": 3,
      "origem": "SALVESEN LOGISTICA PORTUGAL",
      "nome": "2. FRUSTOCK - FOOD SERVICE, S.A.",
      "morada": "RUA CASAL NOVO QUINTA DO PROFE",
      "codigo_postal": "2710-023",
      "cidade": "SINTRA",
      "data_limite": "2026-06-08",
      "hora_limite": "13:29",
      "temperatura": "4",
      "peso_kg": 453.26,
      "pales": 0.74,
      "pedido": "5023024845 / 415168950",
      "fornecedor": "Danone Portugal (011)",
      "confianca": 1
    },
    {
      "sequencia": 4,
      "origem": "SALVESEN LOGISTICA AZAMBUJA 2",
      "nome": "FRUSTOCK-DISTRIBUIÇAO AL",
      "morada": "RUA DO CASAL NOVO, QUIN",
      "codigo_postal": null,
      "cidade": "LISBOA",
      "data_limite": "2026-06-08",
      "hora_limite": "08:00",
      "temperatura": "Ambiente",
      "peso_kg": 311.16,
      "pales": 0.38,
      "pedido": "5023000826 / 415168950",
      "fornecedor": "Alpro Portugal (311)",
      "confianca": 1
    },
    {
      "sequencia": 5,
      "origem": "SALVESEN LOGISTICA AZAMBUJA 2",
      "nome": "LIDL LOURES",
      "morada": "E N 250 RUA CASAL DOS REIS",
      "codigo_postal": "2670-566",
      "cidade": "LOURES",
      "data_limite": "2026-06-08",
      "hora_limite": "08:00",
      "temperatura": "4",
      "peso_kg": 1139.31,
      "pales": 1.48,
      "pedido": null,
      "fornecedor": null,
      "confianca": 0.6
    }
  ],
  "confianca_ocr": 0.9,
  "necessita_revisao": true
}